Артикул;"Основная категория товара";"Подраздел категории товара";Наименование;Описание;Производитель;"Артикул производителя";"Цена (Розница)";"Цена (Опт)";"Можно купить";"На складе";"Время отгрузки";Размер;Цвет;aID;Материал;Батарейки;Упаковка;"Вес (брутто)";"Фотография маленькая до 150*150";"Фотография 1";"Фотография 2";"Фотография 3";"Фотография 4";"Фотография 5";Штрихкод
28;Вибраторы;"Вращающиеся (ротаторы)";"Ротатор RealistickCock на присоске с пультом управления - 16 см.";"Этот вибратор, так похожий на живую плоть, создан во имя сексуального удовлетворения женщины. И его способности – яркое тому доказательство!  Он не просто погружается в лоно до основания-мошонки. Он не только вибрирует всем своим упругим тельцем.  Его изюминка – вращение вокруг продольной оси, благодаря которому массаж вагины становится сверх чувственным! Управлять интенсивностью ротации можно при помощи выносного пульта. Длина - 16 см, Диаметр - 4 см.";"Doc Johnson";1157-01-BX;6388.00;3650.30;0;0;3;;;32;латекс;"3 шт., тип AAA";"картонная коробка";500;http://feed.p5s.ru/images/small/0/small_28.jpg;http://feed.p5s.ru/images/big/0/28.jpg;http://feed.p5s.ru/images/big/0/28-1.jpg;http://feed.p5s.ru/images/big/0/28-2.jpg;;;782421166809
52;Фаллоимитаторы;"Классические дилдо";"Латексный фаллоимитатор - 19 см.";"В отличие от своих собратьев, этот упругий фаллос  радует  и реалистичностью, и рельефом.  Вздувшиеся вены по всей длине секс-игрушки обещают яркую стимуляцию стеночек лона.  А далеко не маленькие размеры – чувственное исследование самых тёмных уголков!  ";"California Exotic Novelties";SE-0190-01-2;1288.00;677.78;0;0;3;;;56;латекс;;блистер;;http://feed.p5s.ru/images/small/0/small_52.jpg;http://feed.p5s.ru/images/big/0/52.jpg;http://feed.p5s.ru/images/big/0/52-1.jpg;http://feed.p5s.ru/images/big/0/52-2.jpg;;;716770017239
53;Фаллоимитаторы;"Классические дилдо";"Рельефный фаллоимитатор - 25 см.";"Прозрачный силиконовый фаллоимитатор, длина 25 см, диаметр 4 см. Рельефный по всей длине. Это своеобразный тренажер, манипуляции с которым позволяют мужчинам предложить своей партнерше новые сексуальные игры, а женщинам более полно изучить собственные сексуальные реакции. ";"Doc Johnson";0286-02-CD;1497.00;713.00;0;0;3;;;57;силикон;;блистер;;http://feed.p5s.ru/images/small/0/small_53.jpg;http://feed.p5s.ru/images/big/0/53.jpg;http://feed.p5s.ru/images/big/0/53-1.jpg;;;;782421123703
54;Фаллоимитаторы;"Классические дилдо";"Латексный фаллоимитатор с рельефом - 21 см.";"Если Вы предпочитаете яркие сексуальные ощущения, рекомендуем классический фаллоимитатор с особым рельефом. Игрушка изготовлена из латекса, имеет удлиненный размер (21 см) и увеличенный диаметр (4,5 см).  Благодаря особой структуре латекса, партнерше гарантированы незабываемые, фееричные ощущения. Изделие легко моется, не требует особого ухода. Латексный имитатор полового члена. Длина - 21 см, Диаметр - 4,5 см.";"California Exotic Novelties";SE-0191-01-2;1507.00;793.00;0;0;3;;телесный;58;латекс;;блистер;;http://feed.p5s.ru/images/small/0/small_54.jpg;http://feed.p5s.ru/images/big/0/54.jpg;http://feed.p5s.ru/images/big/0/54-1.jpg;http://feed.p5s.ru/images/big/0/54-2.jpg;;;"716770028891, 716770017253"
56;Фаллоимитаторы;Двусторонние;"Лесбийский фаллоимитатор из прозрачного материала - 31 см.";"Длинный-предлинный двухголовый фаллоимитатор из прозрачного геля -   секс-игрушка для настоящих ценителей экспериментов и необычных удовольствий. Проявите фантазию и воспользуйтесь новыми возможностями вместе со своей подружкой. Возможно, вы узнаете о себе нечто действительно новое! ";"Doc Johnson";0287-02-CD;1809.00;952.32;0;0;3;;прозрачный;60;"поливинилхлорид (ПВХ, PVC)";;блистер;;http://feed.p5s.ru/images/small/0/small_56.jpg;http://feed.p5s.ru/images/big/0/56.jpg;http://feed.p5s.ru/images/big/0/56-1.jpg;;;;782421124106
57;Фаллоимитаторы;Двусторонние;"Двухголовый фаллос телесного цвета - 29,5 см.";"Этот двухголовый «мальчик» точно сделает сексуальные отношения вашей гомосексуальной пары более гармоничными.  Одно рельефное тельце на двоих. Две чётко очерченные головки для каждой из вас. Бурная сексуальная разрядка для вас обеих!  Ласкайте секс-игрушкой вагину партнёрши или введите двухголовый фаллос в себя и в тело любимой одновременно. Двигаясь друг другу навстречу, вы испытаете целую бурю сексуальных ощущений!  ";"Doc Johnson";0212-02-CD;2008.00;1115.60;0;0;3;;телесный;61;"поливинилхлорид (ПВХ, PVC)";;блистер;500;http://feed.p5s.ru/images/small/0/small_57.jpg;http://feed.p5s.ru/images/big/0/57.jpg;http://feed.p5s.ru/images/big/0/57-1.jpg;http://feed.p5s.ru/images/big/0/57-2.jpg;;;782421104207
60;Фаллоимитаторы;Реалистичные;"Фаллоимитатор Черный Гром - 30 см.";"Знакомьтесь, Чёрный Гром… Ну, или самая впечатляющая его часть. Этот фаллос на присоске – точная копия предмета гордости (и славы) актёра ХХХ-жанра Black Thunder.  Погружая в себя игрушку нешуточных размеров, вы поймёте, что Гром не зря получил своё имя: от его изогнутой мощи внутри всё так и взрывается наслаждением!  Длина - 30 см. Диаметр - 6 см.";"Doc Johnson";8180-01-BX;8021.00;4583.31;1;13;2;;;64;латекс;;"картонная коробка";;http://feed.p5s.ru/images/small/0/small_60.jpg;http://feed.p5s.ru/images/big/0/60.jpg;http://feed.p5s.ru/images/big/0/60-1.jpg;http://feed.p5s.ru/images/big/0/60-2.jpg;http://feed.p5s.ru/images/big/0/60-3.jpg;http://feed.p5s.ru/images/big/0/60-4.jpg;782421449506
72;Фаллоимитаторы;Реалистичные;"Фаллоимитатор реалистик Джеф Страйкер - 25,5 см.";"Этот фаллос оригинальной изогнутой формы с розовой головкой и мощным упругим тельцем – точная копия полового члена популярнейшей звезды фильмов для взрослых Джеффа Страйкера.  Фаллоимитатор немалых размеров реалистичен как на вид, так и на ощупь. А потому способен превратить вагинальную стимуляцию в настоящую секс-феерию!  Присоска на основании позволит вам заниматься сексом с мини-Джеффом в любой удобной позе.  Выполнен из мягкого материала - Ультра Реалистик, максимально напоминающего живое тело. ";"Doc Johnson";0272-02-BX;6375.00;3642.87;0;0;3;;телесный;76;UR3;;"картонная коробка";;http://feed.p5s.ru/images/small/0/small_72.jpg;http://feed.p5s.ru/images/big/0/72.jpg;http://feed.p5s.ru/images/big/0/72-1.jpg;http://feed.p5s.ru/images/big/0/72-2.jpg;;;782421507008
78;Вибраторы;Реалистики;"Суперреалистичный вибромассажер - 21 см.";"Суперреалистичный вибромассажер с выносным пультом уплавления вибрацией.  ";"Doc Johnson";1160-02-BX;6936.00;3963.42;0;0;3;;телесный;82;UR3;"2 шт., тип AA";"картонная коробка";;http://feed.p5s.ru/images/small/0/small_78.jpg;http://feed.p5s.ru/images/big/0/78.jpg;http://feed.p5s.ru/images/big/0/78-1.jpg;;;;782421005689
79;Вибраторы;Реалистики;"Суперреалистичный вибромассажер - 16 см.";"Реалистичный вибромассажер с выносным пультом управления подарит Вам массу удовольствий.  ";"Doc Johnson";1160-01-BX;7027.00;4015.20;0;0;3;;телесный;83;"Термопластичный эластомер (TPE)";"2 шт., тип AA";"картонная коробка";;http://feed.p5s.ru/images/small/0/small_79.jpg;http://feed.p5s.ru/images/big/0/79.jpg;;;;;782421489304
80;Вибраторы;Реалистики;"Фаллоимитатор KONG на присоске c вибратором и пультом управления";"С таким крупным вибратором просто невозможно испытать толику удовольствия. Наслаждению – быть, причём максимальному!  Упругий фаллос способен заполнить собой лоно так чувственно, воздействовать на каждую его клеточку мультискоростной вибрацией и нежным скольжением.  Благодаря присоске на основании и выносному пульту управления позициям для секса с Конгом не будет числа! Длина от основания - 21 см. Диаметр - 5,5 см.";"Doc Johnson";0273-02-BX;6509.00;3719.56;0;0;3;;;84;латекс;"2 шт., тип AA";"картонная коробка";721;http://feed.p5s.ru/images/small/0/small_80.jpg;http://feed.p5s.ru/images/big/0/80.jpg;http://feed.p5s.ru/images/big/0/80-1.jpg;http://feed.p5s.ru/images/big/0/80-2.jpg;;;782421122607
83;Вибраторы;Реалистики;"Реалистичный гигант на присоске с пультом управления вибрацией JEFF STRYKER - 26 см.";"Эта секс-игрушка представляет собой точную копию напряжённой плоти Джеффа Страйкера – известнейшего американского актёра  ХХХ-фильмов.  Упругий фаллос немалых размеров способен подарить вам максимальное наслаждение при вагинальной стимуляции.  Всё, что вам нужно для блаженного секса с Джеффом, - зафиксировать игрушку на жёсткой поверхности и включить мультискоростную вибрацию при помощи выносного пульта управления! Длина - 26 см Максимальный диаметр - 6 см. В комплекте чехол для хранения изделия и фото звезды с автографом.";"Doc Johnson";1159-02-BX;6692.00;3824.13;1;8;2;;;87;латекс;"2 шт., тип AA";"картонная коробка";;http://feed.p5s.ru/images/small/0/small_83.jpg;http://feed.p5s.ru/images/big/0/83.jpg;http://feed.p5s.ru/images/big/0/83-1.jpg;http://feed.p5s.ru/images/big/0/83-2.jpg;http://feed.p5s.ru/images/big/0/83-3.jpg;;782421167707
86;"BDSM, садо-мазо товары";"Интимные украшения";"Серебристые колечки для сосков FETISH FANTASY";"Колечки-клипсы – это не только красивое украшение, но и предмет, приумножающий вашу сексуальность. К вашим соскам в сладостном плену колец так и хочется прикоснуться языком и губами!  Ношение клипс принесёт вам удовольствие. Всё это благодаря кончикам с шариками, сдавливающим грудь – чем не чувственная стимуляция? ";Pipedream;PD3603-26;719.00;359.37;1;11;2;;серебро;90;металл;;блистер;;http://feed.p5s.ru/images/small/0/small_86.jpg;http://feed.p5s.ru/images/big/0/86.jpg;http://feed.p5s.ru/images/big/0/86-1.jpg;;;;603912138184
91;"BDSM, садо-мазо товары";"Интимные украшения";"Клипсы на грудь Japanese Clover Clamps";"Зажимы на грудь сложной конструкции с тонкими канатиками. ";Pipedream;PD3605-02;1515.00;797.30;1;11;2;;;95;металл;;блистер;;http://feed.p5s.ru/images/small/0/small_91.jpg;http://feed.p5s.ru/images/big/0/91.jpg;http://feed.p5s.ru/images/big/0/91-1.jpg;http://feed.p5s.ru/images/big/0/91-2.jpg;;;603912112375
96;Вибраторы;Классические;"Вибромассажер с тремя степенями вибрации iVibe Rabbit Strawberry";"Скажите «нет» сексуальной неудовлетворённости, выбрав этот яркий вибромассажёр с клиторальным стимулятором-коготком!  Погружая его в лоно, вы с лёгкостью достигнете мощной разрядки. Виной тому послужит как клиторальный массаж и восьмискоростная вибрация упругого тельца, так и вращение скрытых внутри бусинок.  Благодаря водонепроницаемости секс-забавы с ротатором можно перенести за пределы спальни, например, в душ или сауну.  Три степени вибрации и вращения шариков, супер современный пульт управления вибрацией. В рабочем состоянии происходит одновременное вращение головки, перемещение бусинок-шариков по оси вращения и вибрация, что позволяет женщине быстрее достичь оргазма, так как стимулируются участки, в которых находится наибольшее скопление нервных окончаний (быстровозбудимые эрогенные зоны) - это клитор (клиторальный вибратор), первые 5 см влагалища (перемещение шариков внутри тела фаллоимитатора) и G-точка (вращение головки).  Вибромассажер оснащен встроенным пультом управления, с помощью которого можно включать, выключать и регулировать мощность ротации (вращательных движений) и движения бусин, регулировать сочетание направления ротации и направления вибрации клиторального стимулятора и частоту вибрации клиторального стимулятора. Длина (полная) - 26 см. Диаметр - 3.5 см.";"Doc Johnson";6001-01-BX;9626.00;6210.15;0;0;3;;;100;силикон;"4 шт., тип AA";"пластиковая коробка";;http://feed.p5s.ru/images/small/0/small_96.jpg;http://feed.p5s.ru/images/big/0/96.jpg;http://feed.p5s.ru/images/big/0/96-1.jpg;;;;782421490508
101;"BDSM, садо-мазо товары";"Интимные украшения";"Клипсы-колечки с голубой бусинкой на соски";"Клипсы-колечки с украшением на соски из светлого металла серебристого цвета с голубым камнем. Не требуют прокалывания. ";"California Exotic Novelties";SE-2634-05-2;648.00;287.79;0;0;3;;;105;металл;;блистер;;http://feed.p5s.ru/images/small/0/small_101.jpg;http://feed.p5s.ru/images/big/0/101.jpg;;;;;716770017147
122;"Анальные игрушки";"Анальные шарики, цепочки";"Анальные бусы  Хвост Дракона ";"Анальные бусы «Хвост дракона» - это лучшее средство для того чтобы «разогреть» попку как следует перед анальным проникновением.  Погружая анальные бусы глубже в анус, вы заполняете его шариками всё больших размеров. Всего их 10, и каждый из них оставит свой чувственный след внутри тела – удержать стоны не удастся.  Чтобы анальными бусами «Хвост дракона» было удобно управлять, на конце имеется небольшое колечко. Длина - 25 см. Максимальный диаметр - 2,7 см. Минимальный диаметр - 1 см. Анальные бусы  Хвост дракона  наш бестселлер!";Gopaldas;"2K79LV BCD GP";532.00;236.47;0;0;3;;фиолетовый;126;силикон;;блистер;101;http://feed.p5s.ru/images/small/0/small_122.jpg;http://feed.p5s.ru/images/big/0/122.jpg;;;;;4890888211898
124;"Анальные игрушки";"Анальные шарики, цепочки";"Цепочка из пяти золотистых анальных шариков";"Вам хочется желать анального секса так, словно от этого зависит ваша жизнь? Эти шарики на мягкой сцепке, отливающие золотом, помогут вам возбудиться по максимуму.  Проникая всё глубже в анус, они воздействуют на скрытые в нём нервные окончания – вас начинает потряхивать от возбуждения и нахлынувшего удовольствия. Если же вытягивать их медленно-медленно, наслаждение накроет вас с головой. ";"Seven Creations";"123QG BX GP";290.00;96.80;1;1;1;;золото;128;акрил;;"пластиковая коробка";24;http://feed.p5s.ru/images/small/0/small_124.jpg;http://feed.p5s.ru/images/big/0/124.jpg;http://feed.p5s.ru/images/big/0/124-1.jpg;http://feed.p5s.ru/images/big/0/124-2.jpg;;;4890888012334
125;"Анальные игрушки";"Анальные пробки";"Силиконовая анальная пробка из нежного материала - 11 см.";"Анальная пробка из нежного материала идеальна для начинающих учеников анального секса, позволяет растягивать анальный вход незаметно для окружающих.   Классическая анальная пробка, с подошвой ограничителем. Предназначена для разработки мышц ануса перед контактом, а так же для усиления чувствительности влагалищных стенок и пениса при вагинальном контакте.  ";Gopaldas;"8199SJPR BCD GP";649.00;324.29;1;230;2;;розовый;129;"поливинилхлорид (ПВХ, PVC)";;блистер;81;http://feed.p5s.ru/images/small/0/small_125.jpg;http://feed.p5s.ru/images/big/0/125.jpg;;;;;4890888819964
128;"Анальные игрушки";"Анальные шарики, цепочки";"Фиолетовые анальные бусы SPECTRA GELS";"С этой цепочкой анальные ласки всегда доставят вам удовольствие! Ведь она проникает в попку так деликатно, возбуждает так чувственно и скользит так комфортно.  Бусины удовольствия, соединенные в цепь, помогут вам получить порцию наслаждения, а также подготовить анус к проникновению кое-чего большего по габаритам.     Анальные бусы - 10 увеличивающихся шариков, крепко связанных между собой. Мягкая, гибкая цепочка из плотного упругого силикона. Длина цепочки - 27 см. Диаметр шариков 1,7 до 2,4 см. Расстояние между шариками 0,8 см. ";"Doc Johnson";0290-07-CD;1370.00;721.00;0;0;3;;;132;силикон;;блистер;196;http://feed.p5s.ru/images/small/0/small_128.jpg;http://feed.p5s.ru/images/big/0/128.jpg;http://feed.p5s.ru/images/big/0/128-1.jpg;http://feed.p5s.ru/images/big/0/128-2.jpg;;;782421423704
129;"Анальные игрушки";"Анальные пробки";"Гелевая анальная пробка розового цвета - 11,5 см.";"Маленькая розовая анальная пробочка. Упругая и тонкая. Идеально подходит начинающим ученикам анального секса для нежной разработки анального отверстия. Имеет ограничительное основание для безопасного использования. ";"Doc Johnson";0289-01-CD;1082.00;569.40;1;7;1;;розовый;133;"поливинилхлорид (ПВХ, PVC)";;блистер;;http://feed.p5s.ru/images/small/0/small_129.jpg;http://feed.p5s.ru/images/big/0/129.jpg;http://feed.p5s.ru/images/big/0/129-1.jpg;;;;782421124908
